<?xml version="1.0" encoding="UTF-8"?>

<!--L
  Copyright Duke Comprehensive Cancer Center

  Distributed under the OSI-approved BSD 3-Clause License.
  See http://ncip.github.com/catrip/LICENSE.txt for details.
L-->

<simpleGuiServices xmlns:xsi="http://www.w3.org/2001/XMLSchema-instance" xsi:noNamespaceSchemaLocation="simpleQueryInterface-config.xsd">
	<service displayName="caTissueCore" url="http://catrip1.duhs.duke.edu:8080/wsrf/services/cagrid/CaTissueCore_Full" metadataXml="caTissueCore_domainModel.xml" impls="true">
		<targets>
			<objectElement className="edu.wustl.catissuecore.domainobject.impl.TissueSpecimenImpl" refID="18785753-F2FC-3542-E044-0003BA4529A9" displaybleAttributes="type,available,positionDimensionOne,positionDimensionTwo,barcode,activityStatus,quantityInGram,availableQuantityInGram" display="true">
				<associatedObjectTree>
					<Association className="edu.wustl.catissuecore.domainobject.impl.SpecimenCollectionGroupImpl" displaybleAttributes="clinicalDiagnosis,clinicalStatus,activityStatus" refID="18785753-F2E4-3542-E044-0003BA4529A9" roleName="specimenCollectionGroup" display="true">
						<Association className="edu.wustl.catissuecore.domainobject.impl.ClinicalReportImpl" displaybleAttributes="surgicalPathologyNumber" refID="18785753-F306-3542-E044-0003BA4529A9" roleName="clinicalReport" display="true">
							<Association className="edu.wustl.catissuecore.domainobject.impl.ParticipantMedicalIdentifierImpl" displaybleAttributes="id" refID="18785753-F302-3542-E044-0003BA4529A9" roleName="participantMedicalIdentifier" display="false"/>
						</Association>
					</Association>
					<Association className="edu.wustl.catissuecore.domainobject.impl.SpecimenCharacteristicsImpl" displaybleAttributes="tissueSite,tissueSide,pathologicalStatus" refID="18785753-F312-3542-E044-0003BA4529A9" roleName="specimenCharacteristics" display="true"/>
				</associatedObjectTree>
				<foreignAssociationOutboundPath cdeName="medicalRecordNumber">
					<Association className="edu.wustl.catissuecore.domainobject.impl.SpecimenCollectionGroupImpl" roleName="specimenCollectionGroup">
						<Association className="edu.wustl.catissuecore.domainobject.impl.ClinicalReportImpl" roleName="clinicalReport">
							<Association className="edu.wustl.catissuecore.domainobject.impl.ParticipantMedicalIdentifierImpl" roleName="participantMedicalIdentifier"/>
						</Association>
					</Association>
				</foreignAssociationOutboundPath>
			</objectElement>
			<objectElement className="edu.wustl.catissuecore.domainobject.impl.CellSpecimenImpl" refID="18785753-F315-3542-E044-0003BA4529A9" displaybleAttributes="barcode,activityStatus,type,quantityInCellCount,positionDimensionOne,positionDimensionTwo,available,availableQuantityInCellCount" display="true">
				<associatedObjectTree>
					<Association className="edu.wustl.catissuecore.domainobject.impl.SpecimenCollectionGroupImpl" displaybleAttributes="clinicalDiagnosis,clinicalStatus,activityStatus" refID="18785753-F2E4-3542-E044-0003BA4529A9" roleName="specimenCollectionGroup" display="true">
						<Association className="edu.wustl.catissuecore.domainobject.impl.ClinicalReportImpl" displaybleAttributes="surgicalPathologyNumber" refID="18785753-F306-3542-E044-0003BA4529A9" roleName="clinicalReport" display="true"/>
					</Association>
				</associatedObjectTree>
				<foreignAssociationOutboundPath cdeName="medicalRecordNumber">
					<Association className="edu.wustl.catissuecore.domainobject.impl.SpecimenCollectionGroupImpl" roleName="specimenCollectionGroup">
						<Association className="edu.wustl.catissuecore.domainobject.impl.ClinicalReportImpl" roleName="clinicalReport">
							<Association className="edu.wustl.catissuecore.domainobject.impl.ParticipantMedicalIdentifierImpl" roleName="participantMedicalIdentifier"/>
						</Association>
					</Association>
				</foreignAssociationOutboundPath>
			</objectElement>
		</targets>
		<foreignAssociationInboundTree>
			<foreignAssociationInboundPath className="edu.wustl.catissuecore.domainobject.impl.ParticipantImpl" refID="18785753-F2E3-3542-E044-0003BA4529A9" cdeName="medicalRecordNumber" displaybleAttributes="sexGenotype,gender,race,ethnicity,activityStatus" display="true">
				<Association className="edu.wustl.catissuecore.domainobject.impl.ParticipantMedicalIdentifierImpl">
					<Association className="edu.wustl.catissuecore.domainobject.impl.ParticipantImpl" roleName="participant"/>
				</Association>
			</foreignAssociationInboundPath>
		</foreignAssociationInboundTree>
	</service>
	<service displayName="caTissueCAE" url="http://catrip1.duhs.duke.edu:8080/wsrf_cae/services/cagrid/CAE" metadataXml="CaTRIPcaTissueCAE_domainModel.xml" impls="false">
		<targets>
			<objectElement className="edu.duke.catrip.cae.domain.general.Participant" refID="Participant" displaybleAttributes="gender,race,ethnicity" display="true">
				<associatedObjectTree>
					<Association className="edu.duke.catrip.cae.domain.general.ParticipantMedicalIdentifier" refID="ParticipantMedicalIdentifier" roleName="medicalRecordNumberCollection" display="false"/>
					<Association className="edu.pitt.cabig.cae.domain.general.AnnotationEventParameters" refID="AnnotationEventParameters" roleName="annotationEventParameters" display="false">
						<Association className="edu.pitt.cabig.cae.domain.breast.BreastPositiveSurgicalMargin" displaybleAttributes="neoplasmPresent,extentInvolvement,otherExtentInvolvement" refID="BreastPositiveSurgicalMargin" roleName="annotationSetCollection" display="true"/>
						<Association className="edu.pitt.cabig.cae.domain.general.ThreeDimensionalSize" displaybleAttributes="greatestDimension,additionalDimensionY,additionalDimensionZ" refID="ThreeDimensionalSize" roleName="annotationSetCollection" display="true"/>
					</Association>
				</associatedObjectTree>
				<foreignAssociationOutboundPath cdeName="medicalRecordNumber">
					<Association className="edu.duke.catrip.cae.domain.general.ParticipantMedicalIdentifier" roleName="medicalRecordNumberCollection"/>
				</foreignAssociationOutboundPath>
			</objectElement>
		</targets>
		<foreignAssociationInboundTree>
			<foreignAssociationInboundPath className="edu.pitt.cabig.cae.domain.breast.NottinghamHistopathologicGrade" refID="NottinghamHistopathologicGrade" cdeName="medicalRecordNumber" displaybleAttributes="tubuleFormation,nuclearPleomorphism,totalScore,totalScoreMVR" display="true">
				<Association className="edu.duke.catrip.cae.domain.general.ParticipantMedicalIdentifier">
					<Association className="edu.duke.catrip.cae.domain.general.Participant" roleName="participant">
						<Association className="edu.pitt.cabig.cae.domain.general.AnnotationEventParameters" roleName="annotationEventParametersCollection">
							<Association className="edu.pitt.cabig.cae.domain.breast.NottinghamHistopathologicGrade" roleName="annotationSetCollection"/>
						</Association>
					</Association>
				</Association>
			</foreignAssociationInboundPath>
			<foreignAssociationInboundPath className="edu.pitt.cabig.cae.domain.general.ThreeDimensionalSize" refID="ThreeDimensionalSize" cdeName="medicalRecordNumber" displaybleAttributes="greatestDimension,additionalDimensionY,additionalDimensionZ" display="true">
				<Association className="edu.duke.catrip.cae.domain.general.ParticipantMedicalIdentifier">
					<Association className="edu.duke.catrip.cae.domain.general.Participant" roleName="participant">
						<Association className="edu.pitt.cabig.cae.domain.general.AnnotationEventParameters" roleName="annotationEventParametersCollection">
							<Association className="edu.pitt.cabig.cae.domain.general.ThreeDimensionalSize" roleName="annotationSetCollection"/>
						</Association>
					</Association>
				</Association>
			</foreignAssociationInboundPath>
		</foreignAssociationInboundTree>
	</service>
</simpleGuiServices>
